[
  {
    "id": "history-prehistory-settlement",
    "era": "prehistory",
    "year": -6000,
    "period_bg": "6000–5000 г. пр.н.е.",
    "period_en": "6000–5000 BC",
    "title_bg": "Раннонеолитни селища",
    "title_en": "Early Neolithic settlements",
    "summary_bg": "Първите праисторически селища на територията на днешен Пловдив се появяват през неолита — преди повече от 8000 години. Яса тепе в днешния квартал „Лаута“ е сред най-добре проучените селищни могили.",
    "summary_en": "The first prehistoric settlements in the area of present-day Plovdiv appeared in the Neolithic period, more than 8,000 years ago. Yasa Tepe, in today’s Lauta district, is among the best-studied settlement mounds.",
    "source": { "title": "Visit Plovdiv — Prehistory", "url": "https://www.visitplovdiv.com/en/node/293", "accessed_at": "2026-07-09" },
    "secondary_sources": [
      {
        "title": "Plovdiv Municipality — Ancient Plovdiv",
        "url": "https://www.plovdiv.bg/en/tourists/sight-seeing/ancient-plovdiv/",
        "accessed_at": "2026-07-09"
      }
    ],
    "data_quality": "public_source"
  },
  {
    "id": "history-prehistory-nebet-tepe",
    "era": "prehistory",
    "year": -5000,
    "period_bg": "VI–IV хилядолетие пр.н.е.",
    "period_en": "6th–4th millennium BC",
    "title_bg": "Дългата селищна последователност на Небет тепе",
    "title_en": "Nebet Tepe’s long settlement sequence",
    "summary_bg": "Общинските туристически източници поставят най-ранните следи на Небет тепе между неолита през VI хилядолетие пр.н.е. и IV хилядолетие пр.н.е. Слоевете на обекта свидетелстват за многохилядолетна последователност на обитаване, а не за една безспорно датирана „основателна“ година.",
    "summary_en": "Municipal visitor sources place the earliest traces at Nebet Tepe between the Neolithic 6th millennium BC and the 4th millennium BC. Its layers show a settlement sequence spanning millennia, rather than one uncontested founding date.",
    "conflict_notes_bg": "Два актуални общински туристически източника дават различни най-ранни ориентири — VI хилядолетие пр.н.е. и IV хилядолетие пр.н.е.; затова записът представя диапазон вместо привидно точна дата.",
    "conflict_notes_en": "Two current municipal visitor sources give different earliest reference points — the 6th and the 4th millennium BC — so this record presents a range rather than a deceptively exact date.",
    "source": { "title": "Visit Plovdiv — Archaeological Complex Nebet Tepe", "url": "https://www.visitplovdiv.com/en/node/521", "accessed_at": "2026-07-09" },
    "secondary_sources": [
      {
        "title": "Visit Plovdiv — Discover Plovdiv brochure",
        "url": "https://www.visitplovdiv.com/sites/default/files/2026-05-11_visitplovdiv_brochure_discoverplovdiv_EN_DIGITAL.pdf",
        "accessed_at": "2026-07-09"
      }
    ],
    "data_quality": "public_source"
  },
  {
    "id": "history-prehistory-bronze-age",
    "era": "prehistory",
    "year": -2500,
    "period_bg": "III–II хилядолетие пр.н.е. (бронзова епоха)",
    "period_en": "3rd–2nd millennium BC (Bronze Age)",
    "title_bg": "Бронзовата епоха и ранните некрополи",
    "title_en": "The Bronze Age and early necropolises",
    "summary_bg": "През бронзовата епоха селището на хълмовете продължава да съществува, а в околността се появяват погребения. Некрополи край Пловдив са датирани към II–III хилядолетие пр.н.е., бележейки дългия преход към по-късния тракийски град.",
    "summary_en": "Through the Bronze Age the hilltop settlement endured and burials appeared around it. Necropolises near Plovdiv have been dated to the 2nd–3rd millennium BC, marking the long transition toward the later Thracian town.",
    "source": { "title": "Wikipedia — Plovdiv", "url": "https://en.wikipedia.org/wiki/Plovdiv", "accessed_at": "2026-06-22" },
    "data_quality": "public_source"
  },
  {
    "id": "history-thracian-town-bessi",
    "era": "thracian",
    "year": -600,
    "period_bg": "VI – първата половина на V в. пр.н.е.",
    "period_en": "6th to early 5th century BC",
    "title_bg": "Беси и одриси в Пловдивското поле",
    "title_en": "Bessi and Odrysians in the Plovdiv plain",
    "summary_bg": "През VI и първата половина на V в. пр.н.е. политическото средище на бесите е в западната част на Пловдивското поле, а източната е обитавана от одрисите. С възхода на Одриското царство в средата на V в. пр.н.е. то започва да доминира в областта и поглъща съюза на бесите.",
    "summary_en": "In the 6th and early 5th centuries BC, the Bessi’s political centre lay in the western part of the Plovdiv plain, while the eastern part was inhabited by the Odrysians. With the rise of the Odrysian kingdom in the mid-5th century BC, it came to dominate the area and absorbed the Bessi union.",
    "source": { "title": "Visit Plovdiv — Antiquity", "url": "https://www.visitplovdiv.com/en/node/145", "accessed_at": "2026-07-09" },
    "data_quality": "public_source"
  },
  {
    "id": "history-thracian-persian-rule",
    "era": "thracian",
    "year": -516,
    "period_bg": "516–479 г. пр.н.е.",
    "period_en": "516–479 BC",
    "title_bg": "Под персийска власт",
    "title_en": "Under Persian overlordship",
    "summary_bg": "През 516 г. пр.н.е., при управлението на Дарий I, Тракия е включена в Персийската империя. Пълководецът Мардоний отново подчинява областта през 492 г. пр.н.е. и тя остава номинален васал на Персия до 479 г. пр.н.е.",
    "summary_en": "In 516 BC, during the rule of Darius the Great, Thrace was drawn into the Persian Empire. The general Mardonius subjugated the region again in 492 BC, and it remained a nominal Persian vassal until 479 BC.",
    "source": { "title": "Wikipedia — Plovdiv", "url": "https://en.wikipedia.org/wiki/Plovdiv", "accessed_at": "2026-06-22" },
    "data_quality": "public_source"
  },
  {
    "id": "history-thracian-eumolpias",
    "era": "thracian",
    "year": -500,
    "period_bg": "V в. пр.н.е.",
    "period_en": "5th century BC",
    "title_bg": "Тракийският град Евмолпия",
    "title_en": "The Thracian town of Eumolpia",
    "summary_bg": "Общинската историческа справка описва тракийското укрепено селище на Трихълмието като Евмолпия или Евмолпеида. С възхода на Одриското царство през V в. пр.н.е. селището и околностите му попадат в неговата политическа орбита.",
    "summary_en": "The municipality’s historical overview describes the fortified Thracian settlement on the Three Hills as Eumolpia or Eumolpeida. With the rise of the Odrysian kingdom in the 5th century BC, the settlement and its surroundings entered its political orbit.",
    "source": { "title": "Plovdiv Municipality — History", "url": "https://www.plovdiv.bg/en/about-plovdiv/history/", "accessed_at": "2026-07-09" },
    "secondary_sources": [
      {
        "title": "Visit Plovdiv — Antiquity",
        "url": "https://www.visitplovdiv.com/en/node/145",
        "accessed_at": "2026-07-09"
      }
    ],
    "data_quality": "public_source"
  },
  {
    "id": "history-philip-philippopolis",
    "era": "thracian",
    "year": -342,
    "period_bg": "342 г. пр.н.е.",
    "period_en": "342 BC",
    "title_bg": "Филип II и Филипопол",
    "title_en": "Philip II and Philippopolis",
    "summary_bg": "През 342 г. пр.н.е. Филип II Македонски или неговите войски завладяват града. Общинската историческа справка свързва с това завоевание името Филипопол, а туристическата историческа справка — укрепването на селището като опора за по-нататъшната македонска експанзия.",
    "summary_en": "In 342 BC Philip II of Macedon, or his troops, captured the city. The municipal historical overview links that conquest to the name Philippopolis, while the visitor history describes the fortified settlement as a base for further Macedonian expansion.",
    "source": { "title": "Plovdiv Municipality — History", "url": "https://www.plovdiv.bg/en/about-plovdiv/history/", "accessed_at": "2026-07-09" },
    "secondary_sources": [
      {
        "title": "Visit Plovdiv — Antiquity",
        "url": "https://www.visitplovdiv.com/en/node/145",
        "accessed_at": "2026-07-09"
      }
    ],
    "data_quality": "public_source"
  },
  {
    "id": "history-thracian-seuthes-iii",
    "era": "thracian",
    "year": -331,
    "period_bg": "ок. 331 г. пр.н.е.",
    "period_en": "c. 331 BC",
    "title_bg": "Севт III възстановява Одриското царство",
    "title_en": "Seuthes III revives the Odrysian kingdom",
    "summary_bg": "Около десетилетие след македонското завоевание одриският владетел Севт III възстановява тракийското царство под македонска зависимост, след успешно въстание срещу властта на Александър Велики.",
    "summary_en": "About a decade after the Macedonian conquest, the Odrysian ruler Seuthes III re-established the Thracian kingdom under Macedonian suzerainty, following a successful revolt against the rule of Alexander the Great.",
    "source": { "title": "Wikipedia — Plovdiv", "url": "https://en.wikipedia.org/wiki/Plovdiv", "accessed_at": "2026-06-22" },
    "data_quality": "public_source"
  },
  {
    "id": "history-thracian-celts",
    "era": "thracian",
    "year": -270,
    "period_bg": "ок. 270-те г. пр.н.е.",
    "period_en": "c. 270s BC",
    "title_bg": "Разрушен от келтите",
    "title_en": "Destroyed by the Celts",
    "summary_bg": "По време на келтското заселване в Източна Европа градът е разрушен, най-вероятно през 270-те г. пр.н.е., преди животът на хълмовете отново да се възстанови.",
    "summary_en": "During the Celtic settlement of Eastern Europe the city was destroyed, most likely in the 270s BC, before life on the hills recovered once more.",
    "source": { "title": "Wikipedia — Plovdiv", "url": "https://en.wikipedia.org/wiki/Plovdiv", "accessed_at": "2026-06-22" },
    "data_quality": "public_source"
  },
  {
    "id": "history-thracian-philip-v",
    "era": "thracian",
    "year": -183,
    "period_bg": "183 г. пр.н.е.",
    "period_en": "183 BC",
    "title_bg": "Филип V Македонски превзема града",